{
  "name": "svc.read_file",
  "description": "Reads content of a file. Use for analysis. When NOT to use: do not use for binary files.",
  "input_schema": {
    "type": "object",
    "properties": {
      "path": {"type": "string", "description": "The file path"}
    },
    "required": ["path"]
  },
  "input_examples": [
    {"path": "/etc/passwd"}
  ],
  "tags": ["fs", "io"],
  "defer_loading": false
}
